Title,Description,URL
Bebê rondonense ferida com soda líquida apresenta melhoras e deixa a UTI,A bebê rondonense Laura Lis Willemann deixou a Unidade de Terapia Intensiva (UTI) do Hospital de Queimados de Londrina na tarde desta terça-feira (26) e foi...,https://www.opresente.com.br/marechal-candido-rondon/bebe-rondonense-ferida-com-soda-liquida-apresenta-melhoras-e-deixa-a-uti/
Campanha Maio Amarelo 2020 será em formato digital,"Devido à pandemia do coronavírus, período em que a população está sendo orientada a ficar em casa, quando possível, o volume das entregas aumentou e a...",https://www.opresente.com.br/marechal-candido-rondon/campanha-maio-amarelo-2020-sera-em-formato-digital/
Bebê rondonense que se queimou com soda será transferida para hospital especializado em Londrina,"A bebê rondonense de um ano e dois meses Laura Lis Willemann, que se queimou com soda líquida na terça-feira (12) e desde então está internada...",https://www.opresente.com.br/marechal-candido-rondon/bebe-rondonense-que-se-queimou-com-soda-sera-transferida-para-hospital-especializado-em-londrina/
Bebê rondonense de um ano que sofreu queimaduras com soda cáustica passa por cirurgia em Cascavel,"Encontra-se internado em Cascavel um bebê de Marechal Cândido Rondon que sofreu queimaduras com soda cáustica. O acidente aconteceu na terça-feira (12) à tarde, quando a...",https://www.opresente.com.br/marechal-candido-rondon/bebe-rondonense-de-um-ano-que-sofreu-queimaduras-com-soda-caustica-passa-por-cirurgia-em-cascavel/
Passagem de chuva pela região anuncia chegada de nova frente fria na cidade,"Após uma noite chuvosa em Marechal Cândido Rondon, as temperaturas despencaram em todo o estado. A terça-feira (14) tem 95% de chances de registrar novas chuvas....",https://www.opresente.com.br/marechal-candido-rondon/passagem-de-chuva-pela-regiao-anuncia-chegada-de-nova-frente-fria-na-cidade/
Hospital de campanha deve estar pronto em dez dias; veja fotos,"Segue a todo vapor em Marechal Cândido Rondon, junto ao Centro de Eventos do Parque de Exposições, a montagem de um hospital de campanha que será...",https://www.opresente.com.br/marechal-candido-rondon/hospital-de-campanha-deve-estar-pronto-em-dez-dias-veja-fotos/
"10,3 mil rondonenses devem declarar o Imposto de Renda",Falta pouco mais de 30 dias para o prazo final de entrega da declaração do Imposto de Renda Pessoa Física (IRPF) 2020 ano-base 2019. Até as...,https://www.opresente.com.br/marechal-candido-rondon/103-mil-rondonenses-devem-declarar-o-imposto-de-renda/
Dúvidas trabalhistas em tempos de pandemia? Assessor jurídico da Acimacar explica; confira,"A pandemia do novo coronavírus (Covid 19) alterou o cotidiano de toda a população brasileira. Em muitas cidades foi decretado o fechamento de escolas, repartições públicas...",https://www.opresente.com.br/marechal-candido-rondon/duvidas-trabalhistas-em-tempos-de-pandemia/
Duplicação do prolongamento da Avenida Rio Grande do Sul até o Lira deve ser iniciada até maio,"Depois do anúncio, na última sexta-feira (06), de um investimento de R$ 3 milhões para a duplicação do prolongamento da Avenida Rio Grande do Sul, no...",https://www.opresente.com.br/marechal-candido-rondon/duplicacao-do-prolongamento-da-avenida-rio-grande-do-sul-ate-o-lira-deve-ser-iniciada-ate-maio/
Acimacar promove curso “NR 35 – Segurança no Trabalho em Altura”,A Associação Comercial e Empresarial de Marechal Cândido Rondon (Acimacar) promove neste sábado (14) o curso “NR 35 – Segurança no Trabalho em Altura”. Esta normativa...,https://www.opresente.com.br/marechal-candido-rondon/acimacar-promove-curso-nr-35-seguranca-no-trabalho-em-altura/
Carro com placas de Marechal Rondon capota no interior de Mercedes,"Um carro ficou bastante danificado após um acidente registrado por volta das 13h30 deste domingo (08), na estrada que liga Mercedes ao distrito de Três Irmãs....",https://www.opresente.com.br/municipios/carro-com-placas-de-marechal-rondon-capota-no-interior-de-mercedes/
"Palotina, Toledo e Marechal Rondon integram a lista de municípios que podem ganhar centros intergeracionais","Centros Intergeracionais O deputado Marcel Micheletto (PL) participou da audiência com o secretário Ney Leprevost (Justiça, Família e Trabalho) que trata da construção dos centros intergeracionais...",https://www.opresente.com.br/colunas/coluna-adi-pr/palotina-toledo-e-marechal-rondon-integram-a-lista-de-municipios-que-podem-ganhar-centros-intergeracionais/
"Higienópolis, um bairro conhecido pela sua grande extensão territorial","O projeto “O Presente na Comunidade”, estreado em dezembro, tem a finalidade de mostrar à população rondonense as comunidades do município, que recebem a visita da...",https://www.opresente.com.br/marechal-candido-rondon/higienopolis-um-bairro-conhecido-pela-sua-grande-extensao-territorial/
"Há mais de meio século nas ondas do rádio, “Gauchinho” relembra trajetória","Nascido em 1941 em Venâncio Aires, no Rio Grande Sul, Manoel Ferreira Canabarro, popularmente conhecido por Gauchinho, ganhou o carinhoso apelido ao longo de seus 53...",https://www.opresente.com.br/marechal-candido-rondon/ha-mais-de-meio-seculo-nas-ondas-do-radio-gauchinho-relembra-trajetoria/
"Augusto I, Augusto II e Barcelona, os bairros pra lá da BR","“O Presente na Comunidade” O projeto “O Presente na Comunidade”, estreado em dezembro, tem a finalidade de mostrar à população rondonense as comunidades do município, que...",https://www.opresente.com.br/marechal-candido-rondon/augusto-i-augusto-ii-e-barcelona-os-bairros-pra-la-da-br/
Inquérito sobre atropelamento que comoveu a comunidade rondonense deve ser concluído em dez dias,"O grave acidente que culminou com a morte de Irmelia Drews Schmitd, de 80 anos, registrado na última quarta-feira (05), em Marechal Cândido Rondon, causou forte...",https://www.opresente.com.br/marechal-candido-rondon/inquerito-sobre-atropelamento-que-comoveu-a-comunidade-rondonense-deve-ser-concluido-em-dez-dias/
Cerca de mil cicloturistas estarão em Marechal Rondon neste domingo,Marechal Cândido Rondon sedia neste domingo (09) a etapa de abertura do 7º Circuito Regional de Cicloturismo. O evento contará com a participação de cerca de...,https://www.opresente.com.br/marechal-candido-rondon/cerca-de-mil-cicloturistas-estarao-em-marechal-rondon-neste-domingo/
"“Motociclista segue preso até uma decisão da Justiça”, diz delegado","A Polícia Civil, logo após ter tomado conhecimento do violento acidente ocorrido na Avenida Írio Welp, em Marechal Cândido Rondon, na quarta-feira (05), iniciou diligências, coletando...",https://www.opresente.com.br/marechal-candido-rondon/motociclista-segue-preso-ate-uma-decisao-da-justica-diz-delegado/
"Motociclista que atropelou idosa é autuado por homicídio doloso; se condenado, pode pegar até 20 anos de prisão",A Polícia Civil autuou em flagrante por homicídio doloso – quando há intenção de matar – o motociclista que atropelou uma idosa de 80 anos na...,https://www.opresente.com.br/marechal-candido-rondon/motociclista-que-atropelou-idosa-e-autuado-por-homicidio-doloso-se-condenado-pode-pegar-ate-20-anos-de-prisao/
Idosa morre após ser atropelada na Avenida Írio Welp; motociclista é arrastado por 150 metros. Veja vídeo,"Uma idosa de 80 anos não resistiu aos graves ferimentos e morreu após ser atropelada na Avenida Irio Jacob Welp, em Marechal Cândido Rondon, na quarta-feira...",https://www.opresente.com.br/marechal-candido-rondon/idosa-morre-apos-ser-atropelada-na-avenida-irio-welp-motociclista-e-arrastado-por-150-metros-veja-video/
Trânsito rondonense deve passar por novas intervenções em breve,"A Secretaria de Mobilidade Urbana da Prefeitura de Marechal Cândido Rondon iniciou há alguns meses o projeto de melhorias na Avenida Rio Grande do Sul, com...",https://www.opresente.com.br/marechal-candido-rondon/transito-rondonense-deve-passar-por-novas-intervencoes-em-breve/
Inscrição no boleto ao Cicloturismo de Marechal Rondon encerra hoje,"Foi iniciado na segunda-feira (03) o prazo para inscrição no segundo lote promocional para a etapa de Marechal Cândido Rondon do 7º Circuito Regional de Cicloturismo,...",https://www.opresente.com.br/municipios/inscricao-no-boleto-ao-cicloturismo-de-marechal-rondon-encerra-hoje/
Renan Schroder: uma história real do bem vencendo o mal,"A vida não tem sido nada fácil para o Renan nos últimos dois anos. As dores profundas e agudas na cabeça, a paralisia que lhe mantém...",https://www.opresente.com.br/marechal-candido-rondon/renan-schroder-uma-historia-real-do-bem-vencendo-o-mal/
Bairro Primavera: local onde as entidades se unem em prol dos espaços públicos,"“O Presente na Comunidade” O projeto “O Presente na Comunidade”, lançado em dezembro, tem a finalidade de mostrar à população rondonense as comunidades do município, que...",https://www.opresente.com.br/marechal-candido-rondon/bairro-primavera-local-onde-as-entidades-se-unem-em-prol-dos-espacos-publicos/
Hoje é o último dia de inscrições a valores promocionais no Cicloturismo,A venda do primeiro lote promocional de inscrições a R$ 65 à etapa do Cicloturismo de Marechal Cândido Rondon encerra neste domingo (02). De 03 a...,https://www.opresente.com.br/marechal-candido-rondon/hoje-e-o-ultimo-dia-de-inscricoes-a-valores-promocionais-no-cicloturismo/
Inscrições a R$ 65 para o Cicloturismo em Marechal Rondon encerram no domingo,A venda do primeiro lote promocional de inscrições a R$ 65 à etapa do Cicloturismo de Marechal Cândido Rondon encerra no próximo domingo (02). De 03...,https://www.opresente.com.br/esportes/inscricoes-a-r-65-para-o-cicloturismo-em-marechal-rondon-encerram-no-domingo/
Homem é encaminhado à UPA após cair de plano elevado em prédio em Marechal Rondon,Um homem que caiu de um plano elevado foi encaminhado pela equipe do Siate à Unidade de Pronto Atendimento (UPA) de Marechal Cândido Rondon. O cidadão...,https://www.opresente.com.br/marechal-candido-rondon/homem-e-encaminhado-a-upa-apos-cair-de-plano-elevado-em-predio-em-marechal-rondon/
Cicloturismo em Marechal Rondon terá almoço com Boi no Rolete,"No dia 09 de fevereiro, Marechal Cândido Rondon vai sediar a primeira etapa do 7º Circuito Regional de Cicloturismo. A expectativa é que o evento reúna...",https://www.opresente.com.br/esportes/cicloturismo-em-marechal-rondon-tera-almoco-com-boi-no-rolete/
Dirigir sem usar cinto de segurança é a infração campeã de multas em Marechal Rondon; confira o ranking,"Deveria ser hábito, mas infelizmente muitos motoristas insistem em trafegar sem o cinto de segurança pelas ruas e avenidas de Marechal Cândido Rondon. É o que...",https://www.opresente.com.br/marechal-candido-rondon/dirigir-sem-usar-cinto-de-seguranca-e-a-infracao-campea-de-multas-em-marechal-rondon-confira-o-ranking/
Definidas ações de segurança à etapa de cicloturismo em Rondon,Marechal Cândido Rondon sedia em 09 de fevereiro a etapa de abertura do 7º Circuito Regional de Cicloturismo Cataratas do Iguaçu e Caminhos ao Lago de...,https://www.opresente.com.br/marechal-candido-rondon/definidas-acoes-de-seguranca-a-etapa-de-cicloturismo-em-rondon/
Ocorrências de trânsito aumentam quase 25% na Comarca de Marechal Rondon,"A cada 15 minutos, uma pessoa morre no Brasil vítima do trânsito. Segundo dados da administradora do seguro DPVAT (Danos Pessoais por Veículos Automotores Terrestres), em...",https://www.opresente.com.br/municipios/ocorrencias-de-transito-aumentam-quase-25-na-comarca-de-marechal-rondon/
Marechal Rondon realiza etapa de abertura do Regional de Cicloturismo em 09 de fevereiro,Já estão abertas as inscrições para a primeira etapa do 7º Circuito Regional de Cicloturismo Cataratas do Iguaçu e Caminhos ao Lago de Itaipu. Ela será...,https://www.opresente.com.br/marechal-candido-rondon/marechal-rondon-realiza-etapa-de-abertura-do-regional-de-cicloturismo-em-09-de-fevereiro/
Rondonense joga veículo ao acostamento para evitar choque frontal em rodovia; carro despenca em barranco de 15 metros,"A Polícia Rodoviária Estadual, posto de Marechal Cândido Rondon, registrou por volta das 23h30 de sexta-feira (03) acidente de trânsito na rodovia entre Marechal Rondon e...",https://www.opresente.com.br/marechal-candido-rondon/rondonense-joga-veiculo-ao-acostamento-para-evitar-choque-frontal-em-rodovia-carro-despenca-em-barranco-de-15-metros/
Rondonense sofre queda de bicicleta e resulta com trauma de crânio,"Acidente do tipo queda de bicicleta foi registrado na manhã desta quinta-feira (02) no prolongamento da Rua Colombo, na estrada que dá acesso à ONG Arca...",https://www.opresente.com.br/marechal-candido-rondon/rondonense-sofre-queda-de-bicicleta-e-resulta-com-trauma-de-cranio/
Cidadão alcoolizado colide veículo em carro estacionado em Marechal Rondon,Acidente de trânsito foi atendido pela Polícia Militar de Marechal Cândido Rondon por volta das 22h30 de segunda-feira (30). Policiais se dirigiram à Rua Gralha Azul...,https://www.opresente.com.br/policial/cidadao-alcoolizado-colide-veiculo-em-carro-estacionado-em-marechal-rondon/
Homem que empurrava carrinho com papelão é atropelado na Vila Gaúcha,"Equipe do Corpo de Bombeiros prestou socorro na manhã desta terça-feira (24), em Marechal Cândido Rondon, a uma vítima de atropelamento. Trata-se de um idoso de...",https://www.opresente.com.br/marechal-candido-rondon/homem-que-empurrava-carrinho-com-papelao-e-atropelado-na-vila-gaucha/
ONG Arca de Noé promove abaixo-assinado em Marechal Rondon,"Para muitas pessoas os fogos de artifício são sinônimo de festa e alegria, porém, para os animais de estimação eles representam medo e estresse. Isso acontece...",https://www.opresente.com.br/marechal-candido-rondon/ong-arca-de-noe-promove-abaixo-assinado-em-marechal-rondon/
Estouro de panela de pressão fere trabalhadoras na Unioeste em Marechal Rondon,"Duas mulheres resultaram com ferimentos em decorrência de um acidente de trabalho registrado na manhã desta quinta-feira (05), no campus da Unioeste em Marechal Cândido Rondon....",https://www.opresente.com.br/marechal-candido-rondon/estouro-de-panela-de-pressao-fere-trabalhadoras-na-unioeste-em-marechal-rondon/
Projeto “Álcool em festa infantil não é legal!” completa quatro anos com resultados expressivos,"Conhecedora dos efeitos negativos do álcool na sociedade, a Associação Luterana Alvorada de Serviço Social de Marechal Cândido Rondon (Alvorada Social) desenvolve o projeto “Álcool em...",https://www.opresente.com.br/marechal-candido-rondon/projeto-alcool-em-festa-infantil-nao-e-legal-completa-quatro-anos-com-resultados-expressivos/
Secretário Cristiano Metzner destaca as ações do esporte na Câmara de Vereadores,"O secretário de Esporte e Lazer de Marechal Rondon, Cristiano Metzner (Suko), fez uso da tribuna popular da Câmara de Vereadores, na noite de segunda-feira (18)....",https://www.opresente.com.br/poder-legislativo/secretario-cristiano-metzner-destaca-as-acoes-do-esporte-na-camara-de-vereadores/
Pediatra Cezar Moreira será sepultado nesta terça-feira em Marechal Rondon,"O pediatra rondonense Cezar Renato Saldanha Moreira será sepultado nesta terça-feira (19), em Marechal Cândido Rondon. O corpo está sendo velado na capela mortuária da Funerária Santa...",https://www.opresente.com.br/marechal-candido-rondon/pediatra-cezar-moreira-sera-sepultado-nesta-terca-feira-em-marechal-rondon/
Hospital Rondon emite nota sobre o falecimento do pediatra Cezar Moreira,"O Hospital Marechal Cândido Rondon emitiu nota, no início da tarde desta segunda-feira (18), sobre o falecimento de Cezar Renato Saldanha Moreira, médico credenciado à operadora de Planos...",https://www.opresente.com.br/marechal-candido-rondon/hospital-rondon-emite-nota-sobre-o-falecimento-do-pediatra-cezar-moreira/
Portinho pede agilidade na criação do novo parque industrial de Marechal Rondon,"O Poder Legislativo rondonense aprovou, ontem (11), requerimento do vereador Valdir Port (Portinho). Ele solicita ao governo municipal que agilize a conclusão das obras de criação...",https://www.opresente.com.br/poder-legislativo/portinho-pede-agilidade-na-criacao-do-novo-parque-industrial-de-marechal-rondon/
Claudinho solicita detalhes da programação oficial de réveillon em Marechal Rondon,"O vereador presidente Claudio Kohler (Claudinho), apresentou na sessão de ontem (11) requerimento destinado à prefeitura. Ele solicita que a administração municipal informe ao Poder Legislativo...",https://www.opresente.com.br/poder-legislativo/claudinho-solicita-detalhes-da-programacao-oficial-de-reveillon-em-marechal-rondon/
Casos de picadas de escorpiões são registrados no perímetro urbano de Marechal Rondon,"Uma moradora da região central de Marechal Cândido Rondon foi picada por um escorpião na noite de terça-feira (05). Ela estava tomando banho, quando o fato...",https://www.opresente.com.br/marechal-candido-rondon/casos-de-picadas-de-escorpioes-sao-registrados-no-perimetro-urbano-de-marechal-rondon/
Curso sobre norma regulamentadora 05 da Cipa acontece entre quarta e sexta-feira,"Nesta semana, entre quarta (06) e sexta-feira (08), será realizado na Associação Comercial e Empresarial de Marechal Cândido Rondon (Acimacar) curso sobre a Norma Regulamentadora nº...",https://www.opresente.com.br/marechal-candido-rondon/curso-sobre-norma-regulamentadora-05-da-cipa-acontece-entre-quarta-e-sexta-feira/
"Falta regulamentação específica aos patinetes elétricos, afirma comandante da PM","O comandante da 2ª Companhia da Polícia Militar (PM) em Marechal Cândido Rondon, tenente Daniel Zambon, destaca que o Código de Trânsito Brasileiro é o texto-base...",https://www.opresente.com.br/marechal-candido-rondon/falta-regulamentacao-especifica-aos-patinetes-eletricos-afirma-comandante-da-pm/
Patinetes elétricos são os novos queridinhos dos rondonenses,Não é mais realidade somente dos grandes centros urbanos. Marechal Cândido Rondon também teve a mobilidade transformada com a presença de novos veículos: os patinetes elétricos....,https://www.opresente.com.br/marechal-candido-rondon/patinetes-eletricos-sao-os-novos-queridinhos-dos-rondonenses/
Anel viário deve ficar pronto até o fim do ano,"Com investimento de R$ 3,5 milhões e trabalhos iniciados no mês de julho, a reconstrução do Contorno Sul de Marechal Cândido Rondon, mais conhecido como Anel...",https://www.opresente.com.br/marechal-candido-rondon/anel-viario-deve-ficar-pronto-ate-o-fim-do-ano/
Condutor é preso por suspeita de embriaguez após bater em carros estacionados em Marechal Rondon,"O motorista de um VW/Golf acabou preso por suspeita de embriaguez ao volante na noite de domingo (27), em Marechal Cândido Rondon. Por volta das 19...",https://www.opresente.com.br/policial/condutor-e-preso-por-suspeita-de-embriaguez-apos-bater-em-carros-estacionados-em-marechal-rondon/
Infestação de escorpiões preocupa comunidade rondonense; 15 foram encontrados em escola,"O prefeito Marcio Rauber e a secretária de Saúde, Marciane Specht, receberam ontem (24), na prefeitura, o chefe da Divisão de Vigilância Sanitária da Secretaria de...",https://www.opresente.com.br/marechal-candido-rondon/infestacao-de-escorpioes-preocupa-comunidade-rondonense-15-foram-encontrados-em-escola/
Servidor do Estado visita Novo Horizonte e tranquiliza população sobre infestação de escorpiões,"A pedido da secretária de Saúde de Marechal Cândido Rondon, Marciane Specht, Novo horizonte recebeu a visita de Emanuel Marques da Silva, chefe da Divisão de...",https://www.opresente.com.br/marechal-candido-rondon/servidor-do-estado-visita-novo-tres-passos-e-tranquiliza-populacao-sobre-infestacao-de-escorpioes/
Acimacar repassa computador desktop completo para a Polícia Militar,"O Conselho Comunitário de Segurança de Marechal Cândido Rondon (Conseg) realizou reunião na manhã desta quarta-feira (23), na sede da Associação Comercial e Empresarial (Acimacar). Diversos...",https://www.opresente.com.br/marechal-candido-rondon/acimacar-repassa-computador-desktop-completo-para-a-policia-militar/
Acimacar promove curso sobre a norma regulamentadora 05 da Cipa,Entre os dias 23 e 25 de outubro será realizado na Associação Comercial e Empresarial de Marechal Cândido Rondon (Acimacar) curso sobre a Norma Regulamentadora nº...,https://www.opresente.com.br/marechal-candido-rondon/acimacar-promove-curso-sobre-a-norma-regulamentadora-05-da-cipa/
Prefeitura rondonense prepara novas intervenções no trânsito,Após a instalação de travessias elevadas em frente à agência rondonense do Instituto Nacional do Seguro Social (INSS) e nas proximidades da Escola Municipal Criança Feliz...,https://www.opresente.com.br/marechal-candido-rondon/prefeitura-rondonense-prepara-novas-intervencoes-no-transito/
Colaboradoras da Copagril recebem orientações sobre câncer de mama,As colaboradoras da Cooperativa Agroindustrial Copagril foram convidadas para participar de uma palestra de orientação realizada na tarde de quarta-feira (09) no salão social da Associação...,https://www.opresente.com.br/marechal-candido-rondon/colaboradoras-da-copagril-recebem-orientacoes-sobre-cancer-de-mama/
Muro é reconstruído e pista de atletismo será liberada a partir de segunda-feira para a população,"Após ser danificado em razão de acúmulo de água no gramado, devido às chuvas torrenciais há algum tempo, o muro do Estádio Valdir Schneider foi reconstruído....",https://www.opresente.com.br/marechal-candido-rondon/muro-e-reconstruido-e-pista-de-atletismo-sera-liberada-a-partir-de-segunda-feira-para-a-populacao/
Capotamento é registrado próximo de escola em Marechal Rondon; carro era ocupado por mãe e dois filhos,"Um capotamento foi registrado por volta das 09 horas desta quarta-feira (02), no cruzamento das ruas 7 de Setembro e Vitória, no Bairro Alvorada, em Marechal...",https://www.opresente.com.br/policial/capotamento-e-registrado-proximo-de-escola-em-marechal-rondon-carro-era-ocupado-por-mae-e-dois-filhos/
Copagril realiza palestra para funcionários sobre valorização da vida,"Uma das campanhas que mais vem ganhando força e atenção da sociedade é a Setembro Amarelo, a qual visa a prevenção ao suicídio. Engajada com os...",https://www.opresente.com.br/marechal-candido-rondon/copagril-realiza-palestra-para-funcionarios-sobre-valorizacao-da-vida/
Inaugurada a Pista de Bicicross Max Mülling,"Uma manhã muito emocionante. É assim que pode ser resumida a inauguração da Pista de Bicicross Max Mülling, neste domingo (15), no Loteamento Augusto, em Marechal...",https://www.opresente.com.br/marechal-candido-rondon/inaugurada-a-pista-de-bicicross-max-mulling/
Marechal Rondon passa a ter uma das melhores pistas de bicicross do país; inauguração será domingo,"Marechal Cândido Rondon vive um novo momento no bicicross. Após quatro anos sem local adequado para treinar, o município passa a contar com a Pista de...",https://www.opresente.com.br/esportes/marechal-rondon-passa-a-ter-uma-das-melhores-pistas-de-bicicross-do-pais-inauguracao-sera-domingo/
Iniciada recuperação de trechos na Avenida Írio Welp e na Rua Pernambuco,"Foi iniciada na sexta-feira (23) mais uma obra em Marechal Cândido Rondon, que vinha sendo bastante reivindicada pela população. Trata-se da recuperação de trecho da...",https://www.opresente.com.br/marechal-candido-rondon/iniciada-recuperacao-de-trechos-na-avenida-irio-welp-e-na-rua-pernambuco/
Vídeo flagra jovens quebrando placa de trânsito em Marechal Rondon; caso é levado à polícia,Um vídeo transmitido em redes sociais exibe dois jovens quebrando uma placa de trânsito na esquina da Avenida Rio Grande do Sul com a Rua...,https://www.opresente.com.br/policial/video-flagra-jovens-quebrando-placa-de-transito-em-marechal-rondon-caso-e-levado-a-policia/
"Reginaldo Leme fala sobre carreira, automobilismo e Ayrton Senna durante visita a Marechal Rondon","Aconteceu na manhã desta sexta-feira (16), na sede da Sicredi Aliança PR/SP, em Marechal Cândido Rondon, coletiva de imprensa com o jornalista Reginaldo Leme. Na ocasião,...",https://www.opresente.com.br/marechal-candido-rondon/reginaldo-leme-fala-sobre-carreira-automobilismo-e-ayrton-senna-durante-visita-a-marechal-rondon/
Caminhonete roubada em Marechal Rondon é recuperada em Guaíra; suspeito vai preso,"Por volta das 19h30 de terça-feira (06) uma caminhonete Ford/Ranger iniciou fuga em alta velocidade pela cidade de Guaíra, cujo motorista desrespeitou a sinalização de...",https://www.opresente.com.br/policial/caminhonete-roubada-em-marechal-rondon-e-recuperada-em-guaira-suspeito-vai-preso/
"Governo investe R$ 17,5 milhões em rodovias; Marechal Rondon e cidades da região estão na lista","O Governo do Estado está investindo R$ 17,5 milhões nas rodovias no Oeste do Paraná. As obras beneficiam diretamente cerca de 400 mil habitantes, além...",https://www.opresente.com.br/parana/governo-investe-r-175-milhoes-em-rodovias-marechal-rondon-e-cidades-da-regiao-estao-na-lista/
Anel Viário está de “cara” nova; lideranças e empresários enaltecem obra aguardada por 20 anos,"Assunto que esteve na boca do povo por pelo menos 20 anos e que foi tema de debates políticos em Marechal Cândido Rondon, muitos deles...",https://www.opresente.com.br/marechal-candido-rondon/anel-viario-esta-de-cara-nova-liderancas-e-empresarios-enaltecem-obra-aguardada-por-20-anos/
